{
  "schema": "entity_catalog.v1",
  "producer": {
    "tool": "EntityArchitect",
    "version": "0.2.0",
    "generatedAt": "2026-02-22T12:00:00.000Z"
  },
  "meta": {
    "description": "Ashwood Forest entity catalog for Emberfall"
  },
  "entities": [
    {
      "id": "iron-shortsword",
      "name": "Iron Shortsword",
      "category": "weapon",
      "lifecycle_state": "approved",
      "tags": ["melee", "starter", "one-handed"],
      "data": {
        "damage": 8,
        "attack_speed": 1.2,
        "damage_type": "physical",
        "rarity": "common",
        "level_requirement": 1
      }
    },
    {
      "id": "enm-ashwood-spider",
      "name": "Ashwood Spider",
      "category": "enemy",
      "lifecycle_state": "approved",
      "tags": ["beast", "forest", "melee"],
      "data": {
        "level": 2,
        "hp": 30,
        "damage": 5,
        "attack_speed": 0.8,
        "xp_reward": 15,
        "abilities": ["web_spit"],
        "loot_table_ref": "ea:lt-spider-common"
      }
    },
    {
      "id": "enm-ember-wolf",
      "name": "Ember Wolf",
      "category": "enemy",
      "lifecycle_state": "approved",
      "tags": ["beast", "forest", "fire"],
      "data": {
        "level": 3,
        "hp": 45,
        "damage": 8,
        "attack_speed": 1.0,
        "xp_reward": 25,
        "abilities": ["ember_bite"],
        "loot_table_ref": "ea:lt-wolf-common"
      }
    },
    {
      "id": "npc-elder-thorn",
      "name": "Elder Thorn",
      "category": "npc",
      "lifecycle_state": "approved",
      "tags": ["quest-giver", "herbalist", "ashwood-forest"],
      "data": {
        "role": "herbalist",
        "dialogue_ref": "le:ashwood-elder-thorn",
        "quests_offered": ["qf:quest:web-of-problems"],
        "shop_inventory": ["ea:potion-minor-health", "ea:antidote-basic"]
      }
    }
  ]
}
